{
	"id": "jw36q06zmu8rh2v6c7fvos12",
	"type": "Embedding",
	"meta": {
		"en": {
			"name": "Jina - DE / EN",
			"description": "Great German and English Model",
			"long_description": "Great German and English Model",
			"release_notes": "",
			"tags": [
				"feature extraction",
				"onnx",
				"german",
				"english",
				"bert",
				"fill-mask",
				"apache-2.0",
				"🇪🇺 region: eu"
			],
			"use_case": "",
			"icon": "https://cdn-avatars.huggingface.co/v1/production/uploads/603763514de52ff951d89793/AFoybzd5lpBQXEBrQHuTt.png",
			"thumbnail": "",
			"preview_media": [],
			"age_rating": null,
			"website": "",
			"support_url": "",
			"docs_url": "",
			"organization_specific_values": null,
			"created_at": {
				"secs_since_epoch": 1748700109,
				"nanos_since_epoch": 0
			},
			"updated_at": {
				"secs_since_epoch": 1748700109,
				"nanos_since_epoch": 0
			}
		}
	},
	"authors": ["https://huggingface.co/jinaai"],
	"repository": "https://huggingface.co/jinaai/jina-embeddings-v2-base-de",
	"download_link": "https://cdn.flow-like.com/bits/36572799388e2bbaa287fe4bd9404880-11",
	"file_name": "model_quantized.onnx",
	"hash": "c29b0aa275c83b52c7ca1106b4297436d7799066ba8e8e6865fd3a0d8294e3fd",
	"size": 161565240,
	"hub": "api.flow-like.com",
	"parameters": {
		"prefix": {
			"query": "",
			"paragraph": ""
		},
		"pooling": "Mean",
		"provider": {
			"version": null,
			"model_id": null,
			"provider_name": "Local"
		},
		"languages": ["de", "en"],
		"input_length": 8192,
		"vector_length": 768
	},
	"version": "0.0.1",
	"license": "apache-2.0",
	"dependencies": [
		"api.flow-like.com:uhif41iq95mt43kjrt0fuk6z",
		"api.flow-like.com:b144lkg2lzk5ipd0318bb7gp",
		"api.flow-like.com:ie0qj609330pdy5ppixyh867",
		"api.flow-like.com:ig8jb6cmhn6ntdiumqngm0ll"
	],
	"dependency_tree_hash": "2fd9ff95ae0bda3d738401bc634947919e232925ee586780f433f922d2579559",
	"created": "2025-05-31T14:01:49.650+00:00",
	"updated": "2025-05-31T14:01:49.650+00:00"
}
